{"protocol":"G3-ATOMIC-CITY-AUDIT-v1","pairId":"PAIR-KIT-CITY","judgeSlot":"SOL-ULTRA","cells":[{"cellId":"C01","singleCompositionUnit":true,"visibleSolidCount":1,"evidenceBox":[74,131,194,347],"observation":"One detached two-storey house is visible."},{"cellId":"C02","singleCompositionUnit":true,"visibleSolidCount":1,"evidenceBox":[302,142,463,360],"observation":"One long single-storey building is visible."},{"cellId":"C03","singleCompositionUnit":true,"visibleSolidCount":1,"evidenceBox":[594,132,649,352],"observation":"One narrow multi-storey tower is visible."},{"cellId":"C04","singleCompositionUnit":true,"visibleSolidCount":1,"evidenceBox":[807,132,918,348],"observation":"One flat-roofed commercial building is visible."},{"cellId":"C05","singleCompositionUnit":true,"visibleSolidCount":1,"evidenceBox":[49,431,218,647],"observation":"One garage building with joined roof bays is visible."},{"cellId":"C06","singleCompositionUnit":true,"visibleSolidCount":1,"evidenceBox":[280,444,468,662],"observation":"One wide industrial garage is visible."},{"cellId":"C07","singleCompositionUnit":true,"visibleSolidCount":1,"evidenceBox":[564,442,671,658],"observation":"One multi-storey hospital building is visible."},{"cellId":"C08","singleCompositionUnit":true,"visibleSolidCount":1,"evidenceBox":[803,440,934,658],"observation":"One flat-roofed utility building is visible."},{"cellId":"C09","singleCompositionUnit":true,"visibleSolidCount":1,"evidenceBox":[53,740,216,961],"observation":"One square utility building is visible."},{"cellId":"C10","singleCompositionUnit":true,"visibleSolidCount":1,"evidenceBox":[346,756,405,953],"observation":"One water tank on its support frame is visible."},{"cellId":"C11","singleCompositionUnit":true,"visibleSolidCount":1,"evidenceBox":[533,753,720,960],"observation":"One continuous wall segment is visible."},{"cellId":"C12","singleCompositionUnit":true,"visibleSolidCount":1,"evidenceBox":[834,753,899,959],"observation":"One street lamp with its base is visible."}],"map":{"largeBakedCityRasterPresent":false,"evidenceBoxes":[[86,261,255,416],[526,627,858,872]],"observation":"The map shows repeated individual buildings on separately aligned ground tiles."},"criticalFailures":[],"verdict":"PASS"}